{"accepted":true,"apiVersion":"herdforge.dev/v1alpha1","blocking":false,"callbackDestination":"herdforge-coordinator","correlation":{"callbackSequence":7,"candidateSha":"3333333333333333333333333333333333333333","phaseId":"phase-SPE-566-implement","runId":"run-SPE-566-1","scopeId":"scope-SPE-566","task":"SPE-566"},"effectiveModel":"gpt-5.6-luna","evidence":[{"digest":"sha256:4444444444444444444444444444444444444444444444444444444444444444","kind":"test"}],"idempotencyKey":"idem-SPE-558-1","kind":"TrustedJobCallbackReceipt","provider":"openai","scopeDigest":"sha256:4ede6bb11f103f38c8565c487d136b7b240e82bd1484f8e5f0efda6f246f758f","submissionDigest":"sha256:1afd81140222babfc494ca6e71b557b3056372e60a91353eaa37337ea8d0f319","violations":[]}
